{
  "$schema": "../../../../schema/registry-item.json",
  "name": "command-menu-bar",
  "type": "registry:component",
  "title": "Command Menu Bar",
  "description": "A compact horizontal action ribbon containing tool buttons, key shortcuts, and divider rules.",
  "category": "components",
  "dependencies": [
    "react"
  ],
  "registryDependencies": [
    "cn"
  ],
  "files": [
    {
      "path": "command-menu-bar.tsx",
      "type": "registry:component"
    }
  ],
  "tags": [
    "toolbar",
    "menu",
    "command",
    "buttons",
    "shortcuts"
  ],
  "license": "MIT",
  "meta": {
    "difficulty": "starter",
    "subcategory": "navigation",
    "fingerprint": {
      "interactionModel": "toolbar-action-invocation",
      "visualModel": "divided-toolbar-rack",
      "motionModel": "none",
      "layoutModel": "horizontal-toolbar-strip",
      "semanticPurpose": "document-tool-ribbon"
    },
    "features": [
      "keyboard-accessible",
      "reduced-motion-safe",
      "responsive"
    ],
    "peer": {
      "react": ">=19"
    },
    "dna": {
      "genre": "technical",
      "macrostructure": "symmetric",
      "density": "compact",
      "shapeLanguage": "rounded",
      "motionLanguage": "mechanical",
      "typographyStyle": "monospace",
      "colorStrategy": "high-contrast"
    }
  }
}
