{
  "$schema": "https://openui.dev/schema/registry-item.json",
  "name": "wax-seal-stamp",
  "type": "registry:text",
  "title": "Wax Seal Stamp",
  "description": "An initials monogram pressed into a wax disc: radial-gradient wax with irregular blob edge (border-radius trick), debossed lettering via inner shadows, and a press animation on click that re-stamps the seal.",
  "category": "text",
  "dependencies": [
    "react"
  ],
  "registryDependencies": [
    "cn"
  ],
  "files": [
    {
      "path": "wax-seal-stamp.tsx",
      "type": "registry:text",
      "content": "\"use client\";\n\nimport { useState } from \"react\";\nimport { cn } from \"@/lib/cn\";\n\nexport interface WaxSealStampProps {\n  /** One or two initials pressed into the wax. */\n  initials: string;\n  /** Wax colour. */\n  wax?: string;\n  className?: string;\n}\n\nexport function WaxSealStamp({ initials, wax = \"#a03c2e\", className }: WaxSealStampProps) {\n  const [stamps, setStamps] = useState(0);\n  const reduced =\n    typeof window !== \"undefined\" &&\n    window.matchMedia?.(\"(prefers-reduced-motion: reduce)\").matches;\n\n  return (\n    <button\n      type=\"button\"\n      onClick={() => setStamps((value) => value + 1)}\n      className={cn(\n        \"flex h-28 w-28 cursor-pointer items-center justify-center rounded-[46%_54%_52%_48%/54%_46%_52%_48%] border-0\",\n        className,\n      )}\n      aria-label={`Seal stamped with ${initials}`}\n      style={{\n        background: `radial-gradient(circle at 32% 30%, color-mix(in oklab, ${wax}, white 24%), ${wax} 58%, color-mix(in oklab, ${wax}, black 30%))`,\n        boxShadow: \"0 4px 10px rgba(0,0,0,0.3), inset 0 2px 4px rgba(255,255,255,0.25), inset 0 -3px 6px rgba(0,0,0,0.3)\",\n      }}\n    >\n      <span\n        key={stamps}\n        aria-hidden\n        className=\"font-display text-2xl\"\n        style={{\n          color: \"color-mix(in oklab, black, transparent 55%)\",\n          textShadow: \"0 1px 1px rgba(255,255,255,0.35), 0 -1px 1px rgba(0,0,0,0.4)\",\n          letterSpacing: \"0.05em\",\n          animation: stamps > 0 && !reduced ? \"openui-press 380ms cubic-bezier(0.2, 0, 0, 1)\" : undefined,\n        }}\n      >\n        {initials}\n      </span>\n      <style>{`@keyframes openui-press { 0% { transform: scale(1) } 35% { transform: scale(0.86) } 70% { transform: scale(1.06) } 100% { transform: scale(1) } } @media (prefers-reduced-motion: reduce) { span { animation: none !important } }`}</style>\n    </button>\n  );\n}\n\nexport default WaxSealStamp;\n",
      "contentHash": "b4b6a8bc50ebd92de18a799b304d902f317d461c532682d9292ccbcaa7199ca7",
      "sizeBytes": 1889
    },
    {
      "path": "demo.tsx",
      "type": "registry:text",
      "content": "import { WaxSealStamp } from \"./wax-seal-stamp\";\n\nexport default function Demo() {\n  return (\n    <div className=\"flex min-h-[15rem] items-center justify-center bg-paper p-10\">\n      <WaxSealStamp initials=\"OU\" />\n    </div>\n  );\n}\n",
      "contentHash": "31c2997e53f057dd17ce70d49631ecee39a17ac36e2e941cc5d56d2f83ca6f28",
      "sizeBytes": 232
    }
  ],
  "tags": [
    "seal",
    "wax",
    "monogram",
    "stamp"
  ],
  "license": "MIT",
  "meta": {
    "dna": {
      "genre": "luxury",
      "macrostructure": "stack",
      "density": "dense",
      "shapeLanguage": "soft",
      "motionLanguage": "subtle",
      "typographyStyle": "serif-display",
      "colorStrategy": "muted-earth"
    },
    "difficulty": "intermediate",
    "features": [
      "keyboard-accessible",
      "reduced-motion-safe",
      "responsive"
    ],
    "peer": {
      "react": ">=19"
    },
    "subcategory": "editorial",
    "fingerprint": {
      "interactionModel": "click-restamp",
      "visualModel": "debossed-wax-disc",
      "motionModel": "press-imprint",
      "layoutModel": "badge",
      "semanticPurpose": "authenticity-mark"
    }
  },
  "url": "https://uniquefingerprint.web.app/r/wax-seal-stamp.json",
  "designRules": "# Design System\n\nGenre: Luxury\nMacrostructure: Stack\nDensity: Dense\nShape: Soft\nMotion: Subtle\nTypography: Serif Display\nColor: Muted Earth\n\n## Rules\n\n- Click Restamp: the interaction model is part of the design, not an add-on.\n- Reduced motion replaces animation with a state change; nothing is hidden behind motion.\n- The component composes through `cn` and never hardcodes colours.\n\n## Avoid\n\n- Reskinning this resource and republishing it under a new name.\n- Adding shadows or radii that contradict its shape language.\n"
}
