{
  "$schema": "../schema/registry-item.json",
  "name": "activity-audit-feed",
  "type": "registry:block",
  "title": "Activity Audit Feed",
  "description": "A chronological organization activity log displaying deployment timestamps, author details, and action metadata.",
  "category": "blocks",
  "dependencies": [],
  "registryDependencies": [
    "cn"
  ],
  "files": [
    {
      "path": "activity-audit-feed.tsx",
      "type": "registry:block",
      "content": "\"use client\";\n\nimport * as React from \"react\";\nimport { cn } from \"@/lib/cn\";\n\nexport function ActivityAuditFeed({\n  className,\n  ...props\n}: React.HTMLAttributes<HTMLDivElement>) {\n  const events = [\n    { user: \"Cyril Chris\", action: \"Published v2.4.0 registry manifests\", time: \"10m ago\" },\n    { user: \"Elena Rostova\", action: \"Merged Pull Request #800: Master Catalog\", time: \"1h ago\" },\n    { user: \"Marcus Vance\", action: \"Executed automated typecheck verification\", time: \"2h ago\" },\n  ];\n\n  return (\n    <div className={cn(\"w-full max-w-3xl mx-auto p-6 bg-white dark:bg-neutral-950 border border-neutral-200 dark:border-neutral-800 rounded-2xl shadow-sm text-xs\", className)} {...props}>\n      <h3 className=\"text-base font-bold text-neutral-900 dark:text-white mb-4\">Activity Ledger</h3>\n      <div className=\"space-y-3\">\n        {events.map((e, idx) => (\n          <div key={idx} className=\"p-3 rounded-xl border border-neutral-200 dark:border-neutral-800 bg-neutral-50/40 dark:bg-neutral-900/30 flex items-center justify-between\">\n            <div>\n              <span className=\"font-semibold text-neutral-900 dark:text-white\">{e.user}</span>{\" \"}\n              <span className=\"text-neutral-600 dark:text-neutral-400\">{e.action}</span>\n            </div>\n            <span className=\"text-neutral-400 font-mono text-[11px] shrink-0 ml-4\">{e.time}</span>\n          </div>\n        ))}\n      </div>\n    </div>\n  );\n}\n",
      "contentHash": "11b83dbafbe4dbbb487e0a40fd4da1585ba849dc0a6a34f7a71e0d5deece7e7b",
      "sizeBytes": 1428
    },
    {
      "path": "demo.tsx",
      "type": "registry:block",
      "content": "\"use client\";\n\nimport { ActivityAuditFeed } from \"./activity-audit-feed\";\n\nexport default function Demo() {\n  return (\n    <div className=\"w-full min-h-[350px] p-4 flex items-center justify-center bg-neutral-100 dark:bg-neutral-900\">\n      <ActivityAuditFeed />\n    </div>\n  );\n}\n",
      "contentHash": "da85a82b49641ba69efb1b104b0f4f12e48106a612e0a132099bd84a68dfcf6a",
      "sizeBytes": 280
    }
  ],
  "tags": [
    "activity",
    "audit",
    "feed",
    "timeline",
    "logs"
  ],
  "license": "MIT",
  "meta": {
    "dna": {
      "genre": "minimal",
      "macrostructure": "stack",
      "density": "medium",
      "shapeLanguage": "rounded",
      "motionLanguage": "subtle",
      "typographyStyle": "grotesk",
      "colorStrategy": "accent-only"
    },
    "difficulty": "intermediate",
    "features": [
      "keyboard-accessible",
      "reduced-motion-safe",
      "responsive"
    ],
    "peer": {
      "react": ">=19"
    },
    "subcategory": "activity",
    "fingerprint": {
      "interactionModel": "audit-stream-filtering",
      "visualModel": "chronological-event-timeline",
      "motionModel": "subtle",
      "layoutModel": "stack-layout",
      "semanticPurpose": "organization-audit-trail"
    }
  },
  "url": "https://openui.dev/r/activity-audit-feed.json",
  "designRules": "# Design System\n\nGenre: Minimal\nMacrostructure: Stack\nDensity: Medium\nShape: Rounded\nMotion: Subtle\nTypography: Grotesk\nColor: Accent Only\n\n## Rules\n\n- Audit Stream Filtering: the interaction model is part of the design, not an add-on.\n- Reduced motion replaces animation with a state change; nothing is hidden behind motion.\n- The component composes through `cn` and never hardcodes colours.\n\n## Avoid\n\n- Reskinning this resource and republishing it under a new name.\n- Adding shadows or radii that contradict its shape language.\n"
}
